{
  "schema_version": "0.1.2",
  "project_name": "handoff-pilot-hypothesis",
  "capsule_type": "ai_task_state_capsule",
  "version_hash": "v20260706-2700-run2",
  "previous_version_hash": "v20260706-2600-run2",
  "branch": "main",
  "created_at": "2026-07-06T07:06:00Z",
  "created_by": "human",
  "status": "active",
  "files": [
    "TASK_STATUS_REPORT.md",
    "DECISION_LOG.md",
    "BRANCH_INFO.md",
    "RESUME_INSTRUCTIONS.md",
    "RECOVERY_CHECK.md",
    "STATE_MANIFEST.json"
  ],
  "notes": "Public sanitized example; RUN-002 complete; HYP-002 accepted on toy domain"
}