{
  "schema_version": "0.1.2",
  "project_name": "Context Relay v0.1 local sidecar planning",
  "capsule_type": "ai_task_state_capsule",
  "version_hash": "v20260705-1430-a1b2",
  "previous_version_hash": null,
  "branch": "main",
  "created_at": "2026-07-05T14:30:00Z",
  "created_by": "ai",
  "status": "active",
  "files": [
    "TASK_STATUS_REPORT.md",
    "DECISION_LOG.md",
    "BRANCH_INFO.md",
    "RESUME_INSTRUCTIONS.md",
    "RECOVERY_CHECK.md",
    "STATE_MANIFEST.json"
  ],
  "notes": "Example capsule for coding-task planning phase."
}