{
  "schema_version": "0.1.2",
  "project_name": "ai-task-state-capsule",
  "capsule_type": "ai_task_state_capsule",
  "version_hash": "v20260706-1600-flow",
  "previous_version_hash": "v20260706-1400-hand",
  "branch": "main",
  "created_at": "2026-07-06T16:00:00Z",
  "created_by": "human",
  "status": "active",
  "files": [
    "TASK_STATUS_REPORT.md",
    "DECISION_LOG.md",
    "BRANCH_INFO.md",
    "RESUME_INSTRUCTIONS.md",
    "RECOVERY_CHECK.md",
    "STATE_MANIFEST.json"
  ],
  "notes": "Pilot checkpoint 3 — handoff test protocol + verify_capsule.py"
}